{
  "$schema": "docs/schema/benchmark-terminology.schema.json",
  "entries": [
    {
      "aggregation_rule": "must not be aggregated unless a referenced formula defines the operation",
      "allowed_values_or_range": "values defined by the referenced benchmark schema",
      "boundary_semantics": "not_applicable",
      "capability_or_freshness_implications": "none beyond the term's normative definition",
      "clock_or_cpu_scope": "not_applicable",
      "concurrency_rule": "does not imply serial execution; use recorded occurrence intervals and dependency relations",
      "configuration_precedence": "not_applicable",
      "data_type": "object or categorical record",
      "definition": "A benchmark run is one execution of the measured product operation with one resolved implementation, capability, scope, and cache manifest.",
      "deprecated_replacement": null,
      "display_name": "Benchmark Run",
      "examples": [],
      "introduced_version": "1.0.0",
      "kind": "benchmark_concept",
      "missing_or_unsupported_behavior": "record an explicit unknown fact; do not infer the value from a label or preset",
      "source_anchors": [
        "docs/schema/benchmark-facts-v2.schema.json",
        "scripts/benchmark-incremental-speed.py"
      ],
      "status": "existing",
      "term_id": "benchmark_run",
      "unit": "not_applicable"
    },
    {
      "aggregation_rule": "must not be aggregated unless a referenced formula defines the operation",
      "allowed_values_or_range": "values defined by the referenced benchmark schema",
      "boundary_semantics": "not_applicable",
      "capability_or_freshness_implications": "none beyond the term's normative definition",
      "clock_or_cpu_scope": "not_applicable",
      "concurrency_rule": "does not imply serial execution; use recorded occurrence intervals and dependency relations",
      "configuration_precedence": "not_applicable",
      "data_type": "object or categorical record",
      "definition": "A repetition is one independently started benchmark run in a cell; repetitions share the cell configuration but not mutable process state unless the cache manifest says otherwise.",
      "deprecated_replacement": null,
      "display_name": "Repetition",
      "examples": [],
      "introduced_version": "1.0.0",
      "kind": "benchmark_concept",
      "missing_or_unsupported_behavior": "record an explicit unknown fact; do not infer the value from a label or preset",
      "source_anchors": [
        "docs/schema/benchmark-facts-v2.schema.json",
        "scripts/benchmark-incremental-speed.py"
      ],
      "status": "existing",
      "term_id": "repetition",
      "unit": "not_applicable"
    },
    {
      "aggregation_rule": "must not be aggregated unless a referenced formula defines the operation",
      "allowed_values_or_range": "values defined by the referenced benchmark schema",
      "boundary_semantics": "not_applicable",
      "capability_or_freshness_implications": "none beyond the term's normative definition",
      "clock_or_cpu_scope": "not_applicable",
      "concurrency_rule": "does not imply serial execution; use recorded occurrence intervals and dependency relations",
      "configuration_precedence": "not_applicable",
      "data_type": "object or categorical record",
      "definition": "A benchmark cell is the set of repetitions that share one declared implementation, workload, effective capability manifest, scope manifest, cache manifest, and correctness contract.",
      "deprecated_replacement": null,
      "display_name": "Benchmark Cell",
      "examples": [],
      "introduced_version": "1.0.0",
      "kind": "benchmark_concept",
      "missing_or_unsupported_behavior": "record an explicit unknown fact; do not infer the value from a label or preset",
      "source_anchors": [
        "docs/schema/benchmark-facts-v2.schema.json",
        "scripts/benchmark-incremental-speed.py"
      ],
      "status": "existing",
      "term_id": "benchmark_cell",
      "unit": "not_applicable"
    },
    {
      "aggregation_rule": "must not be aggregated unless a referenced formula defines the operation",
      "allowed_values_or_range": "values defined by the referenced benchmark schema",
      "boundary_semantics": "not_applicable",
      "capability_or_freshness_implications": "none beyond the term's normative definition",
      "clock_or_cpu_scope": "not_applicable",
      "concurrency_rule": "does not imply serial execution; use recorded occurrence intervals and dependency relations",
      "configuration_precedence": "not_applicable",
      "data_type": "object or categorical record",
      "definition": "A user lifecycle is one user-visible operation measured between two harness-owned monotonic boundary events.",
      "deprecated_replacement": null,
      "display_name": "User Lifecycle",
      "examples": [],
      "introduced_version": "1.0.0",
      "kind": "benchmark_concept",
      "missing_or_unsupported_behavior": "record an explicit unknown fact; do not infer the value from a label or preset",
      "source_anchors": [
        "docs/schema/benchmark-facts-v2.schema.json",
        "scripts/benchmark-incremental-speed.py"
      ],
      "status": "existing",
      "term_id": "user_lifecycle",
      "unit": "not_applicable"
    },
    {
      "aggregation_rule": "must not be aggregated unless a referenced formula defines the operation",
      "allowed_values_or_range": "values defined by the referenced benchmark schema",
      "boundary_semantics": "not_applicable",
      "capability_or_freshness_implications": "none beyond the term's normative definition",
      "clock_or_cpu_scope": "not_applicable",
      "concurrency_rule": "does not imply serial execution; use recorded occurrence intervals and dependency relations",
      "configuration_precedence": "not_applicable",
      "data_type": "object or categorical record",
      "definition": "A step is a registry-defined kind of work performed during a benchmark run.",
      "deprecated_replacement": null,
      "display_name": "Step",
      "examples": [],
      "introduced_version": "1.0.0",
      "kind": "benchmark_concept",
      "missing_or_unsupported_behavior": "record an explicit unknown fact; do not infer the value from a label or preset",
      "source_anchors": [
        "docs/schema/benchmark-facts-v2.schema.json",
        "scripts/benchmark-incremental-speed.py"
      ],
      "status": "existing",
      "term_id": "step",
      "unit": "not_applicable"
    },
    {
      "aggregation_rule": "must not be aggregated unless a referenced formula defines the operation",
      "allowed_values_or_range": "values defined by the referenced benchmark schema",
      "boundary_semantics": "not_applicable",
      "capability_or_freshness_implications": "none beyond the term's normative definition",
      "clock_or_cpu_scope": "not_applicable",
      "concurrency_rule": "does not imply serial execution; use recorded occurrence intervals and dependency relations",
      "configuration_precedence": "not_applicable",
      "data_type": "object or categorical record",
      "definition": "A step occurrence is one execution of a step; every repeated or concurrent occurrence has its own occurrence ID.",
      "deprecated_replacement": null,
      "display_name": "Step Occurrence",
      "examples": [],
      "introduced_version": "1.0.0",
      "kind": "benchmark_concept",
      "missing_or_unsupported_behavior": "record an explicit unknown fact; do not infer the value from a label or preset",
      "source_anchors": [
        "docs/schema/benchmark-facts-v2.schema.json",
        "scripts/benchmark-incremental-speed.py"
      ],
      "status": "existing",
      "term_id": "step_occurrence",
      "unit": "not_applicable"
    },
    {
      "aggregation_rule": "must not be aggregated unless a referenced formula defines the operation",
      "allowed_values_or_range": "values defined by the referenced benchmark schema",
      "boundary_semantics": "not_applicable",
      "capability_or_freshness_implications": "none beyond the term's normative definition",
      "clock_or_cpu_scope": "not_applicable",
      "concurrency_rule": "does not imply serial execution; use recorded occurrence intervals and dependency relations",
      "configuration_precedence": "not_applicable",
      "data_type": "object or categorical record",
      "definition": "A parent relation records structural nesting between two step occurrences and does not by itself impose execution order.",
      "deprecated_replacement": null,
      "display_name": "Parent Relation",
      "examples": [],
      "introduced_version": "1.0.0",
      "kind": "benchmark_concept",
      "missing_or_unsupported_behavior": "record an explicit unknown fact; do not infer the value from a label or preset",
      "source_anchors": [
        "docs/schema/benchmark-facts-v2.schema.json",
        "scripts/benchmark-incremental-speed.py"
      ],
      "status": "existing",
      "term_id": "parent_relation",
      "unit": "not_applicable"
    },
    {
      "aggregation_rule": "must not be aggregated unless a referenced formula defines the operation",
      "allowed_values_or_range": "values defined by the referenced benchmark schema",
      "boundary_semantics": "not_applicable",
      "capability_or_freshness_implications": "none beyond the term's normative definition",
      "clock_or_cpu_scope": "not_applicable",
      "concurrency_rule": "does not imply serial execution; use recorded occurrence intervals and dependency relations",
      "configuration_precedence": "not_applicable",
      "data_type": "object or categorical record",
      "definition": "A dependency relation records that one step occurrence must reach a named event before another occurrence can proceed.",
      "deprecated_replacement": null,
      "display_name": "Dependency Relation",
      "examples": [],
      "introduced_version": "1.0.0",